,address,listingby,price,beds,baths,sqft,building_type,price/sqft
721,"150 Sylvan Dr, San Francisco, CA 94132","COMPASS, Richerson P. Farnsworth",$1.60M,3 bds,2 ba,"1,432 sqft",- Sold,
722,"1440 Broadway APT 101, San Francisco, CA 94109","SOTHEBY'S INTERNATIONAL REALTY, Danielle L. Bales","$820,000",1 bd,1 ba,-- sqft,- Sold,
723,"255 Dalewood Way, San Francisco, CA 94127","RIMMA REALTY, Rimma G. Ludovico",$1.50M,4 bds,2 ba,"1,625 sqft",- Sold,
724,"250 King St UNIT 912, San Francisco, CA 94107","ENGEL & VOELKERS SAN FRANCISCO, Masoumeh M. Pahlbod","$780,000",1 bd,1 ba,888 sqft,- Sold,
725,"722 46th Ave, San Francisco, CA 94121","COMPASS, John M. Kirkpatrick",$2.10M,3 bds,2 ba,"2,186 sqft",- Sold,
726,"1239 Scott St, San Francisco, CA 94115",NaN,$--,5 bds,3 ba,"2,549 sqft",- Sold,
727,"667 Campbell Ave, San Francisco, CA 94134","SANFRANREALESTATE.COM, Timothy J. Cannon",$1.22M,3 bds,2 ba,"1,248 sqft",- Sold,
728,"351 Lakeshore Dr, San Francisco, CA 94132","VANGUARD PROPERTIES, Howard Reinstein",$1.88M,4 bds,4 ba,"1,863 sqft",- Sold,
729,"374 11th St UNIT 3, San Francisco, CA 94103","VANGUARD PROPERTIES, Kirk M. Dahle","$890,000",1 bd,2 ba,"1,137 sqft",- Sold,
730,"733 Front St UNIT 209, San Francisco, CA 94111","COMPASS SF, Dean R. Sereni","$900,000",1 bd,1 ba,-- sqft,- Sold,
731,"580 Missouri St #B, San Francisco, CA 94107","ASCEND REAL ESTATE, Daniel J. Risman-Jones",$1.90M,3 bds,4 ba,"1,660 sqft",- Sold,
732,"572 Valencia St, San Francisco, CA 94110","MARCUS & MILLICHAP, Joseph V. Levy",$2.96M,-- bds,-- ba,"5,990 sqft",- Sold,
733,"400 Beale St APT 1901, San Francisco, CA 94105","KW PENINSULA ESTATES, Michelle Ye",$1.33M,2 bds,2 ba,"1,223 sqft",- Sold,
734,"247 27th Ave #B, San Francisco, CA 94121","KINDRED SF HOMES, Jamie Comer",$1.51M,3 bds,2 ba,"1,297 sqft",- Sold,
735,"2999 California St #203, San Francisco, CA 94115","KELLER WILLIAMS SAN FRANCISCO, Jennifer Rosdail","$670,000",1 bd,1 ba,613 sqft,- Sold,
736,"488 Roosevelt Way, San Francisco, CA 94114","AETHOS REAL ESTATE, John L. Woodruff III",$1.63M,3 bds,2 ba,"1,530 sqft",- Sold,
737,"679 Athens St, San Francisco, CA 94112","COMPASS, Robert R. Wall, Jr.",$1.58M,4 bds,2 ba,"1,300 sqft",- Sold,
738,"1188 Green St #10, San Francisco, CA 94109","KELLER WILLIAMS SAN FRANCISCO, Miyuki Mia Takami","$505,000",Studio,1 ba,-- sqft,- Sold,
739,"215 Arguello Blvd, San Francisco, CA 94118","SOTHEBY'S INTERNATIONAL REALTY, Linda Bettencourt",$1.78M,3 bds,2 ba,"1,854 sqft",- Sold,
740,"1970 Sacramento St APT 101, San Francisco, CA 94109",NaN,$1.35M,2 bds,1 ba,"1,444 sqft",- Sold,
741,"69 Joost Ave, San Francisco, CA 94131","COMPASS, Ken L. Glidewell",$1.28M,2 bds,2 ba,"1,347 sqft",- Sold,
742,"3550 Market St APT 101, San Francisco, CA 94131","VANGUARD PROPERTIES, Andrea F. Swetland",$1.15M,2 bds,2 ba,"1,143 sqft",- Sold,
743,"25 Anzavista Ave, San Francisco, CA 94115","COMPASS SF, Ruth Krishnan",$2.31M,4 bds,3 ba,-- sqft,- Sold,
744,"1155 Broderick St, San Francisco, CA 94115","COMPASS, Shane R. Ray",$1.19M,1 bd,2 ba,900 sqft,- Sold,
745,"77 Dow Pl APT 710, San Francisco, CA 94107","CORCORAN GLOBAL LIVING, Jonathan F. Iddings","$888,000",1 bd,2 ba,"1,164 sqft",- Sold,
746,"1230 46th Ave, San Francisco, CA 94122",NaN,$1.60M,2 bds,1.5 ba,"1,312 sqft",- Sold,
747,NaN,NaN,NaN,NaN,NaN,NaN,NaN,
748,NaN,NaN,NaN,NaN,NaN,NaN,NaN,
749,NaN,NaN,NaN,NaN,NaN,NaN,NaN,
750,"1299 Bush St APT 701, San Francisco, CA 94109","COMPASS SF, Par Hanji","$675,000",1 bd,1 ba,624 sqft,- Sold,
751,"811 Carolina St, San Francisco, CA 94107","COMPASS SF, Helena Zaludova",$4.50M,5 bds,4 ba,"3,565 sqft",- Sold,
752,"337 Webster St, San Francisco, CA 94117","BAYVIEW REAL ESTATE & MORTGAGE, Steve Bach",$2.10M,-- bds,-- ba,"5,157 sqft",- Sold,
753,"151 Bartlett St #153, San Francisco, CA 94110","LUXE PLACES INTERNATIONAL REAL, Gene Gorokhovsky",$1.80M,4 bds,2 ba,"2,803 sqft",- Sold,
754,"1420 Guerrero St #1424, San Francisco, CA 94110","KW PENINSULA ESTATES, Karen Wong-Dunlap",$2.00M,5 bds,3 ba,"3,200 sqft",- Sold,
755,"5124 Diamond Heights Blvd #A, San Francisco, CA 94131","VANGUARD PROPERTIES, Frank A. Nolan",$1.32M,3 bds,2 ba,"1,482 sqft",- Sold,
756,"2835 Larkin St, San Francisco, CA 94109","COMPASS, Ted Bartlett",$4.11M,4 bds,4 ba,"3,500 sqft",- Sold,
757,"151 Alice B Toklas Pl UNIT 601, San Francisco, CA 94109","COMPASS, John M. Lee",$1.02M,1 bd,1 ba,933 sqft,- Sold,
758,"1 Burnett Ave N #9, San Francisco, CA 94131","CORE7 REAL ESTATE, Mark N. Shumway",$1.80M,3 bds,3 ba,"2,157 sqft",- Sold,
759,"2336 Bay St, San Francisco, CA 94123","SOTHEBY'S INTERNATIONAL REALTY, Linda Bettencourt",$2.90M,3 bds,2 ba,"1,748 sqft",- Sold,
760,"79 Bemis St, San Francisco, CA 94131","CORCORAN GLOBAL LIVING, Kira K. Mead",$2.40M,3 bds,2 ba,-- sqft,- Sold,
761,"334 Holladay Ave, San Francisco, CA 94110","COMPASS, Aaron M Bellings",$1.40M,3 bds,2 ba,"1,437 sqft",- Sold,
762,"47 Rebecca Ln, San Francisco, CA 94124",NaN,$--,2 bds,-- ba,"1,219 sqft",- Sold,
763,"25 Lucerne St APT 2, San Francisco, CA 94103",NaN,$1.30M,2 bds,3 ba,"1,839 sqft",- Sold,
764,"401 Harrison St APT 43B, San Francisco, CA 94105","COMPASS, Lynne D. Brown",$2.45M,2 bds,2 ba,"1,419 sqft",- Sold,
765,"1669 Alabama St, San Francisco, CA 94110","GENERATION REAL ESTATE, Lamisse Droubi",$3.40M,5 bds,4 ba,"3,040 sqft",- Sold,
766,"1483 26th Ave, San Francisco, CA 94122","SOTHEBY'S INTERNATIONAL REALTY, Grant Edward Beggs",$1.80M,2 bds,2 ba,"1,500 sqft",- Sold,
767,"1650 Broadway #304, San Francisco, CA 94109","VANGUARD PROPERTIES, Frank A. Nolan",$1.59M,2 bds,2 ba,"1,160 sqft",- Sold,
768,"151 Peralta Ave, San Francisco, CA 94110","COMPASS SF, Michael C. Murphy",$2.55M,4 bds,3 ba,"2,601 sqft",- Sold,
769,"318 Madrid St, San Francisco, CA 94112","CORCORAN GLOBAL LIVING, Donna Solen",$1.35M,3 bds,2 ba,"1,641 sqft",- Sold,
770,"228 Liberty St, San Francisco, CA 94114","COMPASS, John R. DiDomenico",$1.92M,3 bds,2 ba,"1,845 sqft",- Sold,
771,NaN,NaN,NaN,NaN,NaN,NaN,NaN,
772,NaN,NaN,NaN,NaN,NaN,NaN,NaN,
773,NaN,NaN,NaN,NaN,NaN,NaN,NaN,
774,NaN,NaN,NaN,NaN,NaN,NaN,NaN,
775,NaN,NaN,NaN,NaN,NaN,NaN,NaN,
776,NaN,NaN,NaN,NaN,NaN,NaN,NaN,
777,NaN,NaN,NaN,NaN,NaN,NaN,NaN,
778,NaN,NaN,NaN,NaN,NaN,NaN,NaN,
779,NaN,NaN,NaN,NaN,NaN,NaN,NaN,
780,NaN,NaN,NaN,NaN,NaN,NaN,NaN,
781,NaN,NaN,NaN,NaN,NaN,NaN,NaN,
782,NaN,NaN,NaN,NaN,NaN,NaN,NaN,
783,NaN,NaN,NaN,NaN,NaN,NaN,NaN,
784,NaN,NaN,NaN,NaN,NaN,NaN,NaN,
785,NaN,NaN,NaN,NaN,NaN,NaN,NaN,
786,"583 Donahue St, San Francisco, CA 94124","COMPASS SF, John W. Macon","$815,000",2 bds,2 ba,"1,373 sqft",- Sold,
787,"299 S Hill Blvd, San Francisco, CA 94112",NaN,$1.09M,2 bds,1 ba,"1,274 sqft",- Sold,
788,"4422 23rd St, San Francisco, CA 94114","COMPASS, Judson B. Gregory",$2.08M,4 bds,3 ba,"2,353 sqft",- Sold,
789,"2634 Octavia St APT 7, San Francisco, CA 94123","CORCORAN GLOBAL LIVING, Eileen M. Mougeot","$515,000",Studio,1 ba,485 sqft,- Sold,
790,"1940 Broadway #4, San Francisco, CA 94109","COLDWELL BANKER REALTY, Joel Goodrich",$6.30M,3 bds,4 ba,"3,456 sqft",- Sold,
791,"128 Borica St #130, San Francisco, CA 94127","KELLER WILLIAMS SF MONTEREY, Kim D. Nguyen",$2.70M,5 bds,4 ba,"3,236 sqft",- Sold,
792,"250 Los Palmos Dr, San Francisco, CA 94127","CORCORAN GLOBAL LIVING, Eileen Bermingham",$1.71M,3 bds,2 ba,-- sqft,- Sold,
793,"935 Filbert St APT 3, San Francisco, CA 94133","CORCORAN GLOBAL LIVING, Stefano Dezerega",$1.21M,1 bd,1 ba,"1,012 sqft",- Sold,
794,"210 Yerba Buena Ave, San Francisco, CA 94127","MORI, PAUL, Paul J. Mori",$1.80M,2 bds,2 ba,"1,550 sqft",- Sold,
795,"2590 Green St, San Francisco, CA 94123",NaN,$19.5M,5 bds,8 ba,"8,630 sqft",- Sold,
796,"580 Hayes St UNIT 201, San Francisco, CA 94102","CORCORAN GLOBAL LIVING, Richard Hurwitz",$1.84M,2 bds,2 ba,"1,248 sqft",- Sold,
797,NaN,NaN,NaN,NaN,NaN,NaN,NaN,
798,"36 Parnassus Ave, San Francisco, CA 94117","COMPASS, John R. DiDomenico",$2.1M,3 bds,3 ba,"2,228 sqft",- Sold,
799,"1 Burnett Ave N #9, San Francisco, CA 94131","CORE7 REAL ESTATE, Mark N. Shumway",$1.8M,3 bds,3 ba,"2,157 sqft",- Sold,
