,address,listingby,price,beds,baths,sqft,building_type,price/sqft
494,"324 Howth St, San Francisco, CA 94112","COMPASS, Danielle H. Lazier",$1.14M,3 bds,2 ba,"1,100 sqft",- Sold,
495,"3514 Pierce St, San Francisco, CA 94123","GOLDEN GATE SOTHEBY'S INTL, Paul Warrin",$2.35M,2 bds,2 ba,"1,521 sqft",- Sold,
496,"1190 Sacramento St #8, San Francisco, CA 94108","SOTHEBY'S INTERNATIONAL REALTY, John O. Asdourian",$1.73M,2 bds,2 ba,-- sqft,- Sold,
497,"338 Potrero Ave UNIT 508, San Francisco, CA 94103","COMPASS, Deborah L. Nguyen","$950,000",2 bds,2 ba,873 sqft,- Sold,
498,"250 King St UNIT 468, San Francisco, CA 94107","CORCORAN GLOBAL LIVING, Arthur T. Zendarski","$792,000",1 bd,1 ba,795 sqft,- Sold,
499,"2326 Ulloa St, San Francisco, CA 94116","ALEX VARUM BROKER, Alexander S. Varum",$2.30M,5 bds,3 ba,"2,870 sqft",- Sold,
500,"11 Clarendon Ave, San Francisco, CA 94114","VANGUARD PROPERTIES, Michael H. Shaw",$4.10M,4 bds,4 ba,"3,920 sqft",- Sold,
501,"2801 Jackson St APT 201, San Francisco, CA 94115","SOTHEBY'S INTERNATIONAL REALTY, David S. Ayerdi",$1.47M,1 bd,1 ba,"1,139 sqft",- Sold,
502,"260 King St UNIT 525, San Francisco, CA 94107","ENGEL & VOELKERS SAN FRANCISCO, Masoumeh M. Pahlbod","$930,000",2 bds,2 ba,979 sqft,- Sold,
503,"451 Kansas St UNIT 458, San Francisco, CA 94107","COLDWELL BANKER REALTY, Kendra A. Wall",$1.23M,2 bds,2 ba,962 sqft,- Sold,
504,"1332 Chestnut St, San Francisco, CA 94123","GOLDEN GATE SOTHEBY'S INTL, Paul Warrin",$1.86M,3 bds,3 ba,"1,770 sqft",- Sold,
505,"668 Banks St, San Francisco, CA 94110","JENNY HE REALTY ASSOCIATES, Ying He","$999,990",4 bds,2 ba,"1,245 sqft",- Sold,
506,"324 Arguello Blvd APT 3, San Francisco, CA 94118","COMPASS, Amanda M. Jones",$1.48M,2 bds,1 ba,"1,257 sqft",- Sold,
507,"1234 Grove St #1238, San Francisco, CA 94117","COMPASS, Adam D. Filly",$2.58M,-- bds,-- ba,"5,080 sqft",- Sold,
508,"483 28th St #485, San Francisco, CA 94131","COMPASS SF, Brandon Tran",$2.04M,5 bds,3 ba,"2,428 sqft",- Sold,
509,"114 Rousseau St, San Francisco, CA 94112","COMPASS, Renee M. Gonsalves",$1.73M,5 bds,4 ba,"2,156 sqft",- Sold,
510,"240 Lombard St APT 437, San Francisco, CA 94111","SOTHEBY'S INTERNATIONAL REALTY, Edward G. Bate","$525,000",1 bd,1 ba,566 sqft,- Sold,
511,"5118 Diamond Heights Blvd #A, San Francisco, CA 94131","INDIGO REAL ESTATE, Mollie W. Poe",$1.17M,3 bds,2 ba,"1,500 sqft",- Sold,
512,"2201 Sacramento St APT 102, San Francisco, CA 94115","COLDWELL BANKER REALTY, Nina Style",$1.60M,2 bds,2 ba,"1,533 sqft",- Sold,
513,"55 Casa Way, San Francisco, CA 94123","COMPASS, Jay H. Greenberg",$4.65M,10 bds,4 ba,"6,642 sqft",- Sold,
514,"1805 Fillmore St APT 304, San Francisco, CA 94115","VANGUARD PROPERTIES, Drew N. Wilkerson",$1.40M,2 bds,2 ba,"1,215 sqft",- Sold,
515,"563 38th Ave, San Francisco, CA 94121","BETTER HOMES AND GARDENS THRIV, Bair Malunov",$2.70M,4 bds,3 ba,"2,376 sqft",- Sold,
516,"50 Liberty St, San Francisco, CA 94110","ARG REAL ESTATE, Jason D. Gomez",$4.00M,4 bds,4 ba,-- sqft,- Sold,
517,"1575 26th Ave, San Francisco, CA 94122",NaN,$1.70M,2 bds,1 ba,"1,462 sqft",- Sold,
518,"2204 Green St, San Francisco, CA 94123","COMPASS, Nina Hatvany",$2.80M,3 bds,2 ba,"2,188 sqft",- Sold,
519,"3817 Folsom St, San Francisco, CA 94110","COLDWELL BANKER REALTY, Anthony T. Christen",$1.16M,3 bds,-- ba,-- sqft,- Sold,
520,"555 Golden Gate Ave #201, San Francisco, CA 94102","JS SULLIVAN SALES AND MARKETIN, Loring M. Aguillon-Racine","$775,000",1 bd,1 ba,753 sqft,- Sold,
521,"563 38th Ave, San Francisco, CA 94121","BETTER HOMES AND GARDENS THRIV, Bair Malunov",$2.70M,4 bds,3 ba,"2,376 sqft",- Sold,
522,"1688 Pine St #W906, San Francisco, CA 94109",NaN,"$800,000",1 bd,1 ba,689 sqft,- Sold,
523,"2204 Green St, San Francisco, CA 94123","COMPASS, Nina Hatvany",$2.80M,3 bds,2 ba,"2,188 sqft",- Sold,
524,"483 28th St #485, San Francisco, CA 94131","COMPASS SF, Brandon Tran",$2.04M,5 bds,3 ba,"2,428 sqft",- Sold,
525,"240 Lombard St APT 437, San Francisco, CA 94111","SOTHEBY'S INTERNATIONAL REALTY, Edward G. Bate","$525,000",1 bd,1 ba,566 sqft,- Sold,
526,"55 Casa Way, San Francisco, CA 94123","COMPASS, Jay H. Greenberg",$4.65M,10 bds,4 ba,"6,642 sqft",- Sold,
527,"114 Rousseau St, San Francisco, CA 94112","COMPASS, Renee M. Gonsalves",$1.73M,5 bds,4 ba,"2,156 sqft",- Sold,
528,"68 Richardson Ave, San Francisco, CA 94123",NaN,"$975,000",1 bd,1 ba,989 sqft,- Sold,
529,"956 Ashbury St, San Francisco, CA 94117","BILL HARKINS BROKERAGE, INC., Bill Harkins",$3.08M,4 bds,3 ba,"2,555 sqft",- Sold,
530,"2739 Larkin St, San Francisco, CA 94109","COMPASS, Maximillian D. Armour",$3.85M,3 bds,3 ba,-- sqft,- Sold,
531,"135 Manor Dr, San Francisco, CA 94127","COMPASS, Patrick Lowell",$1.55M,2 bds,2 ba,"1,212 sqft",- Sold,
532,"301 Main St UNIT 35A, San Francisco, CA 94105","COMPASS, David  Virella",$2.12M,2 bds,2 ba,"1,268 sqft",- Sold,
533,"2278 14th Ave, San Francisco, CA 94116","RE/MAX GOLD DALY CITY, Beatrice S. Kopilenko",$2.00M,5 bds,6 ba,"2,388 sqft",- Sold,
534,"1742 28th Ave, San Francisco, CA 94122",NaN,$2.40M,2 bds,1 ba,"1,275 sqft",- Sold,
535,"3 Capp St, San Francisco, CA 94103","HATCH REALTY GROUP, INC., Andrea Vanessa Trucios West",$1.01M,2 bds,1 ba,977 sqft,- Sold,
536,"875 Union St, San Francisco, CA 94133","COMPASS, John C. Fitzgerald",$1.65M,3 bds,2 ba,"1,715 sqft",- Sold,
537,"782 36th Ave, San Francisco, CA 94121",NaN,$1.65M,3 bds,2 ba,"1,815 sqft",- Sold,
538,"366 Melrose Ave, San Francisco, CA 94127","COMPASS, Judson B. Gregory",$1.40M,3 bds,2 ba,"1,229 sqft",- Sold,
539,"2407 Harrison St APT 4, San Francisco, CA 94110","CORCORAN GLOBAL LIVING, Pamela Parker Souza",$1.00M,1 bd,2 ba,976 sqft,- Sold,
540,"1108 Dolores St, San Francisco, CA 94110","KELLER WILLIAMS SAN FRANCISCO, Rob J. Costabile",$1.73M,2 bds,2 ba,-- sqft,- Sold,
541,"15 Cityview Way, San Francisco, CA 94131","ARTEMIS REAL ESTATE, Rochelle Vandermerwe",$1.90M,2 bds,2 ba,"1,655 sqft",- Sold,
542,"1001 Saddleback Dr, San Francisco, CA 94134","COLDWELL BANKER REALTY, Dexter Lim","$850,000",3 bds,2 ba,"1,332 sqft",- Sold,
543,"69 Jersey St, San Francisco, CA 94114","KELLER WILLIAMS SAN FRANCISCO, Miyuki Mia Takami",$1.64M,2 bds,1 ba,-- sqft,- Sold,
544,"1954 48th Ave, San Francisco, CA 94116","PINNACLE PROPERTIES, Kenneth A. Hagan",$1.49M,3 bds,1 ba,"1,179 sqft",- Sold,
545,"2999 California St #604, San Francisco, CA 94115",NaN,"$680,000",1 bd,1 ba,653 sqft,- Sold,
546,"102 Webster St, San Francisco, CA 94117","COMPASS SF, Dale T. Boutiette",$1.22M,2 bds,1 ba,"1,062 sqft",- Sold,
547,"69 Summit Way, San Francisco, CA 94132","COLDWELL BANKER REALTY, Daniel Hendel",$1.44M,3 bds,3 ba,"2,133 sqft",- Sold,
548,"890 Dolores St, San Francisco, CA 94110","VANGUARD PROPERTIES, Jean-Paul Samaha",$2.37M,2 bds,2 ba,-- sqft,- Sold,
549,"1 Crescent Way APT 1104, San Francisco, CA 94134",NaN,"$608,000",1 bd,1 ba,814 sqft,- Sold,
550,"1909 Vallejo St, San Francisco, CA 94123","SOTHEBY'S INTERNATIONAL REALTY, Robert R. Callan Jr.",$4.60M,4 bds,4 ba,"2,900 sqft",- Sold,
551,"146 Beaver St, San Francisco, CA 94114","COMPASS, Isabelle Grotte",$1.27M,1 bd,1 ba,895 sqft,- Sold,
552,"986 Guerrero St, San Francisco, CA 94110","GENERATION REAL ESTATE, Lamisse Droubi",$3.20M,3 bds,2 ba,-- sqft,- Sold,
553,"200 Brannan St APT 430, San Francisco, CA 94107","BARBCO, Amy Yuen",$2.10M,2 bds,2 ba,"1,892 sqft",- Sold,
554,"690 Market St UNIT 1803, San Francisco, CA 94104","BARBCO, Betty Xu",$1.57M,2 bds,2 ba,"1,431 sqft",- Sold,
555,"249 Shipley St APT 7, San Francisco, CA 94107","SOTHEBY'S INTERNATIONAL REALTY, Carrie Buchanan-Goodman","$760,000",1 bd,2 ba,893 sqft,- Sold,
556,"338 Main St UNIT 35A, San Francisco, CA 94105","COMPASS, Justin Goldberg",$2.65M,2 bds,2 ba,"1,572 sqft",- Sold,
557,"683 Miramar Ave, San Francisco, CA 94112","COLDWELL BANKER REALTY, Janice Lee",$2.20M,5 bds,4 ba,"2,753 sqft",- Sold,
558,"818 Van Ness Ave APT 704, San Francisco, CA 94109","SOTHEBY'S INTERNATIONAL REALTY, Robert N. Moffatt",$1.19M,2 bds,2 ba,"1,147 sqft",- Sold,
559,"199 New Montgomery St UNIT 1608, San Francisco, CA 94105",NaN,"$839,000",1 bd,1 ba,653 sqft,- Sold,
560,"42 Clairview Ct, San Francisco, CA 94131","COMPASS SF, Mary Macpherson",$2.40M,5 bds,2 ba,"2,250 sqft",- Sold,
561,"1200 California St UNIT 15A, San Francisco, CA 94109","GPK LUXURY REAL ESTATE, Stephen K. Gomez",$1.80M,1 bd,2 ba,"1,450 sqft",- Sold,
562,"101 Lombard St APT 403W, San Francisco, CA 94111","PARK NORTH REAL ESTATE, Lisa M. Marroquin",$1.23M,2 bds,2 ba,"1,423 sqft",- Sold,
563,"522 France Ave, San Francisco, CA 94112","COMPASS, Juanjuan Huang",$1.42M,3 bds,1 ba,"1,352 sqft",- Sold,
564,"4194 17th St, San Francisco, CA 94114",NaN,$1.90M,3 bds,2 ba,"1,361 sqft",- Sold,
565,"440 Panorama Dr, San Francisco, CA 94131","COMPASS, Deborah L. Nguyen",$1.77M,3 bds,2 ba,"1,684 sqft",- Sold,
566,"839 Hayes St, San Francisco, CA 94117","INSPIRE REAL ESTATE, Dan Dodd",$1.60M,4 bds,2 ba,"1,997 sqft",- Sold,
567,"649 Darien Way, San Francisco, CA 94127","CORCORAN GLOBAL LIVING, Erik Reider",$2.58M,3 bds,2 ba,"2,103 sqft",- Sold,
568,"1205 4th Ave APT A, San Francisco, CA 94122","WEST & PRASZKER, REALTORS, Michael Y. Klestoff","$965,000",2 bds,1 ba,963 sqft,- Sold,
569,"300 Beale St APT 418, San Francisco, CA 94105",NaN,$1.10M,1 bd,1 ba,"1,015 sqft",- Sold,
570,"715 Ellsworth St, San Francisco, CA 94110","COMPASS, Danielle H. Lazier",$1.35M,3 bds,2 ba,"1,400 sqft",- Sold,
571,"41 Littlefield Ter, San Francisco, CA 94107","GREEN BANKER, Stanley Lo","$899,000",3 bds,1 ba,956 sqft,- Sold,
572,"1000 N Point St APT 1106, San Francisco, CA 94109","COMPASS, Liliana M. DeMello","$908,000",1 bd,1 ba,-- sqft,- Sold,
573,"3731 Divisadero St, San Francisco, CA 94123","COMPASS, Butch Haze",$3.65M,4 bds,3 ba,"2,577 sqft",- Sold,
574,"2691 22nd Ave, San Francisco, CA 94116","COMPASS, Leon De-Levi",$2.36M,4 bds,4 ba,"2,230 sqft",- Sold,
575,"338 Spear St UNIT 42E, San Francisco, CA 94105","COMPASS, Nina Hatvany",$3.00M,3 bds,2 ba,"1,686 sqft",- Sold,
576,"821 Folsom St APT 107, San Francisco, CA 94107","COMPASS, Teresa A. Callan","$980,000",2 bds,2 ba,"1,102 sqft",- Sold,
577,"1789 Washington St #403, San Francisco, CA 94109","COMPASS, Taa M. Recacho",$1.37M,2 bds,2 ba,"1,050 sqft",- Sold,
578,"730 22nd Ave, San Francisco, CA 94121",NaN,$1.10M,2 bds,1 ba,"1,425 sqft",- Sold,
579,"330 Mission Bay Blvd #116, San Francisco, CA 94158","COMPASS, Robyn L. Kaufman",$1.60M,2 bds,2 ba,"1,569 sqft",- Sold,
580,"570 Moscow St, San Francisco, CA 94112","COMPASS, Juanjuan Huang",$1.91M,4 bds,5 ba,"2,115 sqft",- Sold,
581,"2162 31st Ave, San Francisco, CA 94116","SEQUOIA REAL ESTATE, Sonny Chan",$1.56M,2 bds,1 ba,"1,485 sqft",- Sold,
582,"221 Warren Dr, San Francisco, CA 94131","COMPASS, John M. Kirkpatrick",$1.95M,3 bds,3 ba,"1,770 sqft",- Sold,
583,"3975 Cesar Chavez St #3977, San Francisco, CA 94131","COMPASS SF, Ruth Krishnan",$3.45M,4 bds,4 ba,-- sqft,- Sold,
584,"45 Dolores Ter, San Francisco, CA 94110","SOTHEBY'S INTERNATIONAL REALTY, Chris J. Panou",$1.36M,2 bds,2 ba,-- sqft,- Sold,
585,"250 King St UNIT 1504, San Francisco, CA 94107","KELLER WILLIAMS SAN FRANCISCO, Miyuki Mia Takami","$630,000",1 bd,1 ba,595 sqft,- Sold,
586,"4101 23rd St, San Francisco, CA 94114","MORLEY FREDERICKS REAL ESTATE, Steven M. Crane",$1.62M,4 bds,2 ba,"1,525 sqft",- Sold,
587,"270 Bayview Cir, San Francisco, CA 94124","VANGUARD PROPERTIES, Matthew Tatsumi Gomez","$970,000",2 bds,2 ba,"1,601 sqft",- Sold,
588,"2339 Laguna St, San Francisco, CA 94115","CITY REAL ESTATE, Joan F. Gordon",$4.45M,4 bds,5 ba,"3,405 sqft",- Sold,
589,"176 Merced Ave, San Francisco, CA 94127","BERKSHIRE HATHAWAY-FRANCISCAN, Andrew Herrera II",$2.32M,2 bds,2 ba,"1,674 sqft",- Sold,
590,"1155 Filbert St APT 402, San Francisco, CA 94109","COMPASS, Bridget R. Cannata Denning",$1.30M,2 bds,2 ba,850 sqft,- Sold,
591,"273 Chattanooga St, San Francisco, CA 94114","COMPASS, Connie Chung",$1.71M,3 bds,2 ba,"1,253 sqft",- Sold,
592,"1905 Laguna St APT 305, San Francisco, CA 94115","CORCORAN GLOBAL LIVING, Eduardo Aguire",$1.08M,1 bd,1 ba,768 sqft,- Sold,
593,"175 Bluxome St UNIT 211, San Francisco, CA 94107",NaN,"$925,000",2 bds,2 ba,"1,076 sqft",- Sold,
594,"401 Crescent Ct APT 4306, San Francisco, CA 94134","FAR EAST REALTY, Brian Ngai","$680,000",2 bds,2 ba,935 sqft,- Sold,
595,"43 Downey St, San Francisco, CA 94117","COMPASS SF, John R. Solaegui",$2.10M,3 bds,2 ba,"1,558 sqft",- Sold,
596,"355 1st St UNIT 1208, San Francisco, CA 94105","COMPASS, Robyn L. Kaufman","$738,000",1 bd,1 ba,-- sqft,- Sold,
597,"336 Bradford St, San Francisco, CA 94110","REDFIN, Thomas A. Baumgartner",$1.10M,3 bds,2 ba,"1,450 sqft",- Sold,
598,"539 42nd Ave, San Francisco, CA 94121","COMPASS, Michael B. Soon",$1.72M,4 bds,1 ba,"2,100 sqft",- Sold,
599,"3627 21st St, San Francisco, CA 94114","INDIGO REAL ESTATE, Mollie W. Poe",$4.50M,3 bds,3 ba,"3,003 sqft",- Sold,
600,"1155 Filbert St APT 402, San Francisco, CA 94109","COMPASS, Bridget R. Cannata Denning",$1.30M,2 bds,2 ba,850 sqft,- Sold,
601,"3627 21st St, San Francisco, CA 94114","INDIGO REAL ESTATE, Mollie W. Poe",$4.50M,3 bds,3 ba,"3,003 sqft",- Sold,
602,"2339 Laguna St, San Francisco, CA 94115","CITY REAL ESTATE, Joan F. Gordon",$4.45M,4 bds,5 ba,"3,405 sqft",- Sold,
603,"330 Mission Bay Blvd #116, San Francisco, CA 94158","COMPASS, Robyn L. Kaufman",$1.60M,2 bds,2 ba,"1,569 sqft",- Sold,
604,"338 Spear St UNIT 42E, San Francisco, CA 94105","COMPASS, Nina Hatvany",$3.00M,3 bds,2 ba,"1,686 sqft",- Sold,
605,"712 10th Ave, San Francisco, CA 94118","SOTHEBY'S INTERNATIONAL REALTY, Robert N. Moffatt",$2.00M,3 bds,2 ba,"2,612 sqft",- Sold,
606,"95 Mccoppin St APT E304, San Francisco, CA 94103","STERLING HOMES, Anna G. Spathis","$711,500",1 bd,1 ba,760 sqft,- Sold,
607,"1437 Cabrillo St #1439, San Francisco, CA 94118","SOTHEBY'S INTERNATIONAL REALTY, Annie M. Williams",$1.86M,4 bds,-- ba,"2,550 sqft",- Sold,
608,"1650 Jackson St APT 602, San Francisco, CA 94109","COMPASS, Marianne Bacigalupi Schier",$1.30M,2 bds,2 ba,"1,103 sqft",- Sold,
609,"1940 Anza St APT 5, San Francisco, CA 94118","COMPASS SF, Erica S Levin","$987,000",1 bd,2 ba,850 sqft,- Sold,
610,"2223 27th Ave, San Francisco, CA 94116",NaN,$2.33M,3 bds,2 ba,"2,378 sqft",- Sold,
611,"2224 Clement St #108, San Francisco, CA 94121","NORTH POINT REAL ESTATE, Michael L. Annunziata",$1.38M,3 bds,2 ba,"1,457 sqft",- Sold,
612,"26 Presidio Ter, San Francisco, CA 94118","COMPASS, Neal Allen Ward",$13.6M,6 bds,9 ba,"9,405 sqft",- Sold,
613,"80 Summit Way, San Francisco, CA 94132","COLDWELL BANKER REALTY, Mary Ann Montano",$1.29M,3 bds,2 ba,"1,547 sqft",- Sold,
614,NaN,NaN,NaN,NaN,NaN,NaN,NaN,
615,NaN,NaN,NaN,NaN,NaN,NaN,NaN,
616,NaN,NaN,NaN,NaN,NaN,NaN,NaN,
617,NaN,NaN,NaN,NaN,NaN,NaN,NaN,
618,NaN,NaN,NaN,NaN,NaN,NaN,NaN,
619,NaN,NaN,NaN,NaN,NaN,NaN,NaN,
620,NaN,NaN,NaN,NaN,NaN,NaN,NaN,
621,NaN,NaN,NaN,NaN,NaN,NaN,NaN,
622,NaN,NaN,NaN,NaN,NaN,NaN,NaN,
623,NaN,NaN,NaN,NaN,NaN,NaN,NaN,
624,NaN,NaN,NaN,NaN,NaN,NaN,NaN,
625,NaN,NaN,NaN,NaN,NaN,NaN,NaN,
626,NaN,NaN,NaN,NaN,NaN,NaN,NaN,
627,NaN,NaN,NaN,NaN,NaN,NaN,NaN,
628,NaN,NaN,NaN,NaN,NaN,NaN,NaN,
629,NaN,NaN,NaN,NaN,NaN,NaN,NaN,
630,NaN,NaN,NaN,NaN,NaN,NaN,NaN,
631,"3675 Clay St, San Francisco, CA 94118","MAYNE AND COMPANY, Linda F. Mayne",$5.35M,5 bds,4 ba,"5,003 sqft",- Sold,
632,"749 Congo St, San Francisco, CA 94131","COMPASS, Julie F. Rogers",$1.85M,2 bds,2 ba,"1,534 sqft",- Sold,
633,"360 Country Club Dr, San Francisco, CA 94132","CITY REAL ESTATE, Vivian  Lee",$1.78M,4 bds,2 ba,"1,903 sqft",- Sold,
634,"173 Coleridge St, San Francisco, CA 94110","COMPASS, Faye Dibachi","$750,000",2 bds,2 ba,831 sqft,- Sold,
635,NaN,NaN,NaN,NaN,NaN,NaN,NaN,
636,NaN,NaN,NaN,NaN,NaN,NaN,NaN,
637,"126 Milton St, San Francisco, CA 94112","ENGEL & VOELKERS SAN FRANCISCO, Priscilla Bettencourt Rodrigues",$1.25M,2 bds,2 ba,"1,276 sqft",- Sold,
638,"788 Minna St UNIT 505, San Francisco, CA 94103","VANGUARD PROPERTIES, Catherine Watson","$665,000",1 bd,1 ba,-- sqft,- Sold,
639,"2710 Scott St, San Francisco, CA 94123","COMPASS, Marianne Bacigalupi Schier",$5.35M,4 bds,4 ba,"4,235 sqft",- Sold,
640,"173 Coleridge St, San Francisco, CA 94110","COMPASS, Faye Dibachi","$750,000",2 bds,2 ba,831 sqft,- Sold,
641,"900 Bush St APT 518, San Francisco, CA 94109","CORCORAN GLOBAL LIVING, Samantha R. Hailer","$485,000",1 bd,1 ba,643 sqft,- Sold,
642,"217 Montcalm St, San Francisco, CA 94110","SOTHEBY'S INTERNATIONAL REALTY, Mary E. Lace",$2.15M,2 bds,1 ba,"1,643 sqft",- Sold,
643,"95 Mccoppin St APT E304, San Francisco, CA 94103","STERLING HOMES, Anna G. Spathis","$711,500",1 bd,1 ba,760 sqft,- Sold,
644,"2224 Clement St #108, San Francisco, CA 94121","NORTH POINT REAL ESTATE, Michael L. Annunziata",$1.38M,3 bds,2 ba,"1,457 sqft",- Sold,
645,"360 Country Club Dr, San Francisco, CA 94132","CITY REAL ESTATE, Vivian  Lee",$1.78M,4 bds,2 ba,"1,903 sqft",- Sold,
646,"1437 Cabrillo St #1439, San Francisco, CA 94118","SOTHEBY'S INTERNATIONAL REALTY, Annie M. Williams",$1.86M,4 bds,-- ba,"2,550 sqft",- Sold,
647,"3675 Clay St, San Francisco, CA 94118","MAYNE AND COMPANY, Linda F. Mayne",$5.35M,5 bds,4 ba,"5,003 sqft",- Sold,
648,"105 Prospect Ave #A, San Francisco, CA 94110","VANGUARD PROPERTIES, Denis Lancerin","$960,000",1 bd,1 ba,753 sqft,- Sold,
649,"1755 39th Ave, San Francisco, CA 94122",NaN,$1.67M,3 bds,2 ba,800 sqft,- Sold,
650,"59 Manor Dr, San Francisco, CA 94127","NEW AGE REALTY & MORTGAGE, Mikhail Kurgatnikov",$2.14M,4 bds,3 ba,"3,071 sqft",- Sold,
651,"3615 Buchanan St APT 204, San Francisco, CA 94123",NaN,$1.45M,2 bds,2 ba,"1,169 sqft",- Sold,
652,"2057 15th St APT D, San Francisco, CA 94114","VANGUARD PROPERTIES, Christian Buckley",$1.20M,3 bds,1 ba,"1,312 sqft",- Sold,
653,"2409 Scott St APT 2, San Francisco, CA 94115","COMPASS, Jason H. Hoffman",$1.84M,2 bds,1 ba,-- sqft,- Sold,
654,"1515 15th St APT 401, San Francisco, CA 94103","HOME QUEST REALTY, Robert Belli","$292,001",Studio,1 ba,383 sqft,- Sold,
655,"204 Dore St, San Francisco, CA 94103","VANGUARD PROPERTIES, Carolyn A. Goeldner",$1.75M,8 bds,4 ba,"5,118 sqft",- Sold,
656,"12 Carson St, San Francisco, CA 94114","COMPASS, Shane R. Ray",$2.33M,3 bds,2 ba,"1,905 sqft",- Sold,
657,"333 Beale St #C3C, San Francisco, CA 94105","HELENA GENG, BROKER, Helena Geng",$1.12M,1 bd,2 ba,916 sqft,- Sold,
658,"563 Lisbon St, San Francisco, CA 94112","COMPASS SF, D. Paul Brown",$1.38M,3 bds,3 ba,"1,623 sqft",- Sold,
659,"465 10th St APT 306, San Francisco, CA 94103","CORCORAN GLOBAL LIVING, Richard Hurwitz","$815,000",1 bd,2 ba,694 sqft,- Sold,
660,"3461 17th St #A, San Francisco, CA 94110","COMPASS, Alexander F. Lurie","$800,000",2 bds,1 ba,757 sqft,- Sold,
661,"1688 Pine St #E510, San Francisco, CA 94109","COMPASS, Deborah L. Nguyen","$775,000",1 bd,1 ba,638 sqft,- Sold,
662,"1025 Lake St, San Francisco, CA 94118","VANGUARD PROPERTIES, Christina Ciccone","$630,000",1 bd,1 ba,561 sqft,- Sold,
663,"162 Byxbee St, San Francisco, CA 94132","RE/MAX GOLD DALY CITY, Beatrice S. Kopilenko","$888,000",2 bds,1 ba,812 sqft,- Sold,
664,"735 Geary St APT 201, San Francisco, CA 94109","COMPASS, Amanda M. Jones","$639,000",1 bd,1 ba,822 sqft,- Sold,
665,"100 San Felipe Ave, San Francisco, CA 94127",NaN,$3.40M,4 bds,4 ba,"3,465 sqft",- Sold,
666,"177 Baltimore Way, San Francisco, CA 94112",NaN,$1.28M,3 bds,2 ba,"1,225 sqft",- Sold,
667,"1300 22nd St APT 413, San Francisco, CA 94107","ARTEMIS REAL ESTATE, Rochelle Vandermerwe",$1.31M,2 bds,2 ba,952 sqft,- Sold,
668,"663 7th Ave, San Francisco, CA 94118","KELLER WILLIAMS SAN FRANCISCO, Jonathan E. Dearman",$1.50M,2 bds,2 ba,"1,355 sqft",- Sold,
669,"3960 18th St, San Francisco, CA 94114","COMPASS SF, Ric A. Rocchiccioli",$1.57M,3 bds,1 ba,"1,289 sqft",- Sold,
670,"555 Fulton St UNIT 433, San Francisco, CA 94102",NaN,$1.08M,2 bds,2 ba,887 sqft,- Sold,
671,"712 21st Ave, San Francisco, CA 94121","COMPASS, Patrick Lowell",$1.07M,2 bds,1 ba,849 sqft,- Sold,
672,"1834 Mason St #A, San Francisco, CA 94133","COMPASS, Victoria M. Stewart Davis",$2.00M,3 bds,3 ba,"2,179 sqft",- Sold,
673,"631 24th Ave, San Francisco, CA 94121","SOTHEBY'S INTERNATIONAL REALTY, Wendy M. Storch",$2.20M,3 bds,2 ba,"1,920 sqft",- Sold,
674,"1155 Leavenworth St APT 22, San Francisco, CA 94109","COMPASS, Dena Aslanian-Williams","$555,000",1 bd,1 ba,-- sqft,- Sold,
675,"250 King St UNIT 1606, San Francisco, CA 94107","VANGUARD PROPERTIES, Sean Jeremy Weinstock","$905,000",1 bd,1 ba,982 sqft,- Sold,
676,"181 Fremont St UNIT 65A, San Francisco, CA 94105","MARKER LUXURY PROPERTIES, Kyle Algeo","$24,000",2 bds,3 ba,"1,827 sqft",- Sold,
677,"401 Harrison St APT 12H, San Francisco, CA 94105","SKYBOX REALTY, Pablo M. Cela","$949,000",1 bd,1 ba,759 sqft,- Sold,
678,"345 Molimo Dr, San Francisco, CA 94127","CORCORAN GLOBAL LIVING, Randall N. Kostick",$1.82M,3 bds,2 ba,"1,800 sqft",- Sold,
679,"768 Junipero Serra Blvd, San Francisco, CA 94127","SOTHEBY'S INTERNATIONAL REALTY, Mary Lou Castellanos",$1.56M,2 bds,1 ba,"1,513 sqft",- Sold,
680,"181 Fremont St UNIT 65A, San Francisco, CA 94105","MARKER LUXURY PROPERTIES, Kyle Algeo","$24,000",2 bds,3 ba,"1,827 sqft",- Sold,
681,"162 Byxbee St, San Francisco, CA 94132","RE/MAX GOLD DALY CITY, Beatrice S. Kopilenko","$888,000",2 bds,1 ba,812 sqft,- Sold,
682,"250 King St UNIT 1606, San Francisco, CA 94107","VANGUARD PROPERTIES, Sean Jeremy Weinstock","$905,000",1 bd,1 ba,982 sqft,- Sold,
683,"768 Junipero Serra Blvd, San Francisco, CA 94127","SOTHEBY'S INTERNATIONAL REALTY, Mary Lou Castellanos",$1.56M,2 bds,1 ba,"1,513 sqft",- Sold,
684,"100 San Felipe Ave, San Francisco, CA 94127",NaN,$3.40M,4 bds,4 ba,"3,465 sqft",- Sold,
685,"1688 Pine St #E510, San Francisco, CA 94109","COMPASS, Deborah L. Nguyen","$775,000",1 bd,1 ba,638 sqft,- Sold,
686,"401 Harrison St APT 12H, San Francisco, CA 94105","SKYBOX REALTY, Pablo M. Cela","$949,000",1 bd,1 ba,759 sqft,- Sold,
687,"465 10th St APT 306, San Francisco, CA 94103","CORCORAN GLOBAL LIVING, Richard Hurwitz","$815,000",1 bd,2 ba,694 sqft,- Sold,
688,"1 Stanford Heights Ave, San Francisco, CA 94127","CORCORAN GLOBAL LIVING, John L. LePage",$1.60M,3 bds,2 ba,"1,411 sqft",- Sold,
689,"3461 17th St #A, San Francisco, CA 94110","COMPASS, Alexander F. Lurie","$800,000",2 bds,1 ba,757 sqft,- Sold,
690,"370 Monterey Blvd APT 207, San Francisco, CA 94131","COMPASS, Courtney Cohan","$700,000",1 bd,1 ba,757 sqft,- Sold,
691,"162 Beaver St, San Francisco, CA 94114","COMPASS, Dino Zuzic",$1.95M,2 bds,1 ba,"1,685 sqft",- Sold,
692,"734 14th St APT 3, San Francisco, CA 94114","INSPIRE REAL ESTATE, Dan Dodd",$1.05M,2 bds,1 ba,-- sqft,- Sold,
693,"615 Alvarado St, San Francisco, CA 94114","COMPASS, Stephanie A. Johnson",$3.25M,3 bds,3 ba,-- sqft,- Sold,
694,"2754 Octavia St, San Francisco, CA 94123","COMPASS, Nina Hatvany",$5.87M,5 bds,4 ba,"4,310 sqft",- Sold,
695,"247 Noe St, San Francisco, CA 94114","GENERATION REAL ESTATE, Daniel Yadegar",$1.52M,2 bds,2 ba,"1,394 sqft",- Sold,
696,"1746 Bay St, San Francisco, CA 94123","GOLDEN GATE SOTHEBY'S INTL, Paul Warrin",$2.65M,3 bds,2 ba,"2,135 sqft",- Sold,
697,"929 Bush St APT 3, San Francisco, CA 94109","CORCORAN GLOBAL LIVING, Lauren O'Brien","$599,000",Studio,1 ba,"5,235 sqft",- Sold,
698,"719 Moultrie St, San Francisco, CA 94110","COMPASS SF, Daniel A. Fernandez",$2.02M,3 bds,2 ba,-- sqft,- Sold,
699,"945 Steiner St, San Francisco, CA 94117","COMPASS SF, Mary Macpherson",$3.10M,4 bds,3 ba,"2,635 sqft",- Sold,
700,"2448 Lombard St #410, San Francisco, CA 94123","JS SULLIVAN SALES AND MARKETIN, Loring M. Aguillon-Racine",$1.66M,2 bds,2 ba,"1,141 sqft",- Sold,
701,"900 Bush St PH 5, San Francisco, CA 94109","COMPASS SF, Lyle Chip McAllister",$1.50M,2 bds,2 ba,"1,110 sqft",- Sold,
702,"221 Noe St APT 9, San Francisco, CA 94114",NaN,$1.18M,2 bds,1 ba,832 sqft,- Sold,
703,"355 1st St UNIT S710, San Francisco, CA 94105","BETTER HOMES AND GARDENS THRIV, Masanori C. Sugimoto","$775,000",1 bd,1 ba,675 sqft,- Sold,
704,"1246 Sanchez St, San Francisco, CA 94114","SOTHEBY'S INTERNATIONAL REALTY, Greg Fulford",$2.23M,3 bds,4 ba,"1,750 sqft",- Sold,
705,"60 Rausch St APT 203, San Francisco, CA 94103","VANGUARD PROPERTIES, Michael H. Shaw",$1.23M,2 bds,2 ba,"1,498 sqft",- Sold,
706,"330 Mission Bay Blvd N UNIT 506, San Francisco, CA 94158","KINOKO, Marcell P. Neri",$1.32M,2 bds,2 ba,"1,028 sqft",- Sold,
707,"1727 23rd Ave, San Francisco, CA 94122",NaN,$1.73M,-- bds,1 ba,"1,400 sqft",- Sold,
708,"1500 Francisco St APT 4, San Francisco, CA 94123","COMPASS, Todd D. Montgomery","$920,000",1 bd,1 ba,745 sqft,- Sold,
709,"803 Red Leaf Ct, San Francisco, CA 94134","COMPASS, Dorothy Figueroa Rahal","$800,000",3 bds,2 ba,"1,200 sqft",- Sold,
710,"1688 Pine St UNIT E805, San Francisco, CA 94109","KELLER WILLIAMS SAN FRANCISCO, Sherry Juneja","$965,000",1 bd,1 ba,738 sqft,- Sold,
711,"2135 California St #2, San Francisco, CA 94115","COMPASS SF, Helena Zaludova","$960,000",2 bds,1 ba,962 sqft,- Sold,
712,"1376 Natoma St, San Francisco, CA 94103","KELLER WILLIAMS SAN FRANCISCO, Anthony L. Koutsos","$780,000",2 bds,1 ba,838 sqft,- Sold,
713,"114 Noe St #124, San Francisco, CA 94114",NaN,$3.50M,-- bds,-- ba,-- sqft,- Sold,
714,"2546 Folsom St, San Francisco, CA 94110","ARTEMIS REAL ESTATE, Arrian C. Binnings",$1.80M,3 bds,3 ba,"1,980 sqft",- Sold,
715,"2400 Steiner St #4, San Francisco, CA 94115","COMPASS, Faye Dibachi",$2.05M,2 bds,2 ba,-- sqft,- Sold,
716,"2978 20th Ave, San Francisco, CA 94132","ASCEND REAL ESTATE, Daniel J. Risman-Jones",$2.90M,4 bds,4 ba,"3,023 sqft",- Sold,
717,"544 Clipper St, San Francisco, CA 94114","COMPASS SF, Pete Brannigan",$2.20M,3 bds,2 ba,"1,731 sqft",- Sold,
718,"1932 Fell St APT 4, San Francisco, CA 94117","COMPASS, Connie Chung","$400,000",Studio,1 ba,-- sqft,- Sold,
719,"77 Van Ness Ave APT 809, San Francisco, CA 94102","NOVA REAL ESTATE, Lorraine Meier","$690,000",1 bd,1 ba,555 sqft,- Sold,
720,"8400 Oceanview Ter APT 111, San Francisco, CA 94132","BERKSHIRE HATHAWAY-FRANCISCAN, Heather R. Stoltz","$600,000",1 bd,1 ba,669 sqft,- Sold,
